{
  "$schema": "https://epos.dev/schema.json",
  "name": "epos-template-package",
  "action": "<hub>",
  "targets": [
    {
      "matches": ["<hub>"],
      "load": ["./dist/gl.js", "./dist/gl.css"]
    }
  ],

  "manifest": {
    "name": "Epos Template Package",
    "version": "1.0.0",
    "manifest_version": 3
  }
}
