{
  "$schema": "https://epos.dev/schema.json?v=1",
  "name": "devkit",
  "title": "[epos]",
  "description": "Epos helps you to develop browser extensions.",
  "version": "1.5",
  "targets": [
    {
      "matches": ["<hub>"],
      "load": ["./dist/gl.js", "./dist/tw.css"]
    },
    {
      "matches": ["https://epos.dev/@learn"],
      "load": ["./dist/ln.js", "./dist/tw.css"]
    }
  ]
}
